{
  "$id": "https://github.com/netrunnerdb/netrunner-cards-json/blob/master/schema/v2/printings_schema.json",
  "$schema": "https://json-schema.org/draft/2020-12/schema",
  "type": "array",
  "items": {
    "type": "object",
    "additionalProperties": false,
    "properties": {
      "card_id": {
        "minLength": 1,
        "type": "string"
      },
      "card_set_id": {
        "minLength": 1,
        "type": "string"
      },
      "flavor": {
        "minLength": 1,
        "type": "string"
      },
      "id": {
        "minLength": 1,
        "type": "string"
      },
      "illustrator": {
        "minLength": 1,
        "type": "string"
      },
      "position": {
        "minimum": 1,
        "type": "integer"
      },
      "printed_is_unique": {
        "type": "boolean"
      },
      "printed_text": {
        "type": "string"
      },
      "quantity": {
        "minimum": 1,
        "type": "integer"
      },
      "stripped_printed_text": {
        "type": "string"
      }
    },
    "required": [
      "card_id",
      "card_set_id",
      "id",
      "position",
      "printed_is_unique",
      "quantity"
    ]
  }
}
