[
  {
    "card_id": "retrieval_run",
    "card_set_id": "future_proof",
    "id": "02101",
    "illustrator": "Outland Entertainment LLC",
    "position": 101,
    "printed_is_unique": false,
    "quantity": 3
  },
  {
    "card_id": "darwin",
    "card_set_id": "future_proof",
    "id": "02102",
    "illustrator": "Liiga Smilshkalne",
    "position": 102,
    "printed_is_unique": false,
    "quantity": 3
  },
  {
    "card_id": "data_leak_reversal",
    "card_set_id": "future_proof",
    "flavor": "A two-way solution to a one-way problem, the data leak reversal, or DLR for short, is a misnomer. There is no actual reversal of data, only the creation of a parallel peer-to-peer link with the initial source.",
    "id": "02103",
    "illustrator": "Andrew Mar",
    "position": 103,
    "printed_is_unique": false,
    "quantity": 3
  },
  {
    "card_id": "faerie",
    "card_set_id": "future_proof",
    "flavor": "Do you believe in faeries?",
    "id": "02104",
    "illustrator": "Sara K. Diesel",
    "position": 104,
    "printed_is_unique": false,
    "quantity": 3
  },
  {
    "card_id": "mr_li",
    "card_set_id": "future_proof",
    "flavor": "\"We're always happy to help, Mr. Santiago.\"\n\"I appreciate it, Mr. Li.\"\n\"We'll be in touch. And, Gabriel…\"\n\"Yes?\"\n\"Don't leave town.\"",
    "id": "02105",
    "illustrator": "Gong Studios",
    "position": 105,
    "printed_is_unique": true,
    "quantity": 3
  },
  {
    "card_id": "indexing",
    "card_set_id": "future_proof",
    "flavor": "A little corporate restructuring is necessary once in a while.",
    "id": "02106",
    "illustrator": "Mauricio Herrera",
    "position": 106,
    "printed_is_unique": false,
    "quantity": 3
  },
  {
    "card_id": "r_d_interface",
    "card_set_id": "future_proof",
    "flavor": "Works best at your own desk.",
    "id": "02107",
    "illustrator": "Reza Ilyasa",
    "position": 107,
    "printed_is_unique": false,
    "quantity": 3
  },
  {
    "card_id": "deep_thought",
    "card_set_id": "future_proof",
    "id": "02108",
    "illustrator": "Anna Ignatieva",
    "position": 108,
    "printed_is_unique": false,
    "quantity": 3
  },
  {
    "card_id": "new_angeles_city_hall",
    "card_set_id": "future_proof",
    "flavor": "\"New Angeles is the jewel of modern civilization, and its government the envy of nations.\" -Mayor Wells",
    "id": "02109",
    "illustrator": "Henning Ludvigsen",
    "position": 109,
    "printed_is_unique": true,
    "quantity": 3
  },
  {
    "card_id": "eli_1_0",
    "card_set_id": "future_proof",
    "flavor": "\"That's against the rules. The Creators will be angry.\"",
    "id": "02110",
    "illustrator": "Sandara Tang",
    "position": 110,
    "printed_is_unique": false,
    "quantity": 3
  },
  {
    "card_id": "ruhr_valley",
    "card_set_id": "future_proof",
    "flavor": "Known for luxury hoppers and a delectable sauerkraut.",
    "id": "02111",
    "illustrator": "Yoann Boissonnet",
    "position": 111,
    "printed_is_unique": false,
    "quantity": 3
  },
  {
    "card_id": "ronin",
    "card_set_id": "future_proof",
    "flavor": "\"I will serve you…for a time.\"",
    "id": "02112",
    "illustrator": "Adam S. Doyle",
    "position": 112,
    "printed_is_unique": false,
    "quantity": 3
  },
  {
    "card_id": "midori",
    "card_set_id": "future_proof",
    "flavor": "\"Looks like someone is being naughty…\"",
    "id": "02113",
    "illustrator": "RJ Palmer",
    "position": 113,
    "printed_is_unique": true,
    "quantity": 3
  },
  {
    "card_id": "nbn_the_world_is_yours",
    "card_set_id": "future_proof",
    "flavor": "*Some restrictions may apply. Scan this card to find out more.",
    "id": "02114",
    "position": 114,
    "printed_is_unique": false,
    "quantity": 3
  },
  {
    "card_id": "project_beale",
    "card_set_id": "future_proof",
    "id": "02115",
    "illustrator": "Matt Zeilinger",
    "position": 115,
    "printed_is_unique": false,
    "quantity": 3
  },
  {
    "card_id": "midseason_replacements",
    "card_set_id": "future_proof",
    "id": "02116",
    "illustrator": "Christina Davis",
    "position": 116,
    "printed_is_unique": false,
    "quantity": 3
  },
  {
    "card_id": "flare",
    "card_set_id": "future_proof",
    "flavor": "A bright light blossomed, and then the console went dark. That's when she smelled smoke.",
    "id": "02117",
    "illustrator": "Mike Nesbitt",
    "position": 117,
    "printed_is_unique": false,
    "quantity": 3
  },
  {
    "card_id": "dedicated_response_team",
    "card_set_id": "future_proof",
    "flavor": "They don't call them dedicated for nothing.",
    "id": "02118",
    "illustrator": "Reza Ilyasa",
    "position": 118,
    "printed_is_unique": false,
    "quantity": 3
  },
  {
    "card_id": "burke_bugs",
    "card_set_id": "future_proof",
    "flavor": "\"If I had to describe the bugs in one word, it would be '****ing annoying.'\" -Whizzard",
    "id": "02119",
    "illustrator": "Reza Ilyasa",
    "position": 119,
    "printed_is_unique": false,
    "quantity": 3
  },
  {
    "card_id": "corporate_war",
    "card_set_id": "future_proof",
    "flavor": "There were several ways to win a corporate war. One of them was to bring out the bazookas.",
    "id": "02120",
    "illustrator": "Gong Studios",
    "position": 120,
    "printed_is_unique": false,
    "quantity": 3
  }
]
