[
  {
    "card_id": "credit_crash",
    "card_set_id": "blood_money",
    "id": "11021",
    "illustrator": "Jenn Tran",
    "position": 21,
    "printed_is_unique": false,
    "quantity": 3
  },
  {
    "card_id": "rumor_mill",
    "card_set_id": "blood_money",
    "flavor": "\"You can have a lot of fun in 23 seconds.\" -Princess Space Kitten",
    "id": "11022",
    "illustrator": "Tim Durning",
    "position": 22,
    "printed_is_unique": false,
    "quantity": 3
  },
  {
    "card_id": "nfr",
    "card_set_id": "blood_money",
    "flavor": "Balance out the equation.",
    "id": "11023",
    "illustrator": "Mariusz Siergiejew",
    "position": 23,
    "printed_is_unique": false,
    "quantity": 3
  },
  {
    "card_id": "paperclip",
    "card_set_id": "blood_money",
    "flavor": "\"It is not wise to call someone crazy until you fully understand what they're trying to say.\" -Omar Keung",
    "id": "11024",
    "illustrator": "Adam S. Doyle",
    "position": 24,
    "printed_is_unique": false,
    "quantity": 3
  },
  {
    "card_id": "golden",
    "card_set_id": "blood_money",
    "flavor": "The program was as close to a hunting raptor as she could afford...for now.",
    "id": "11025",
    "illustrator": "Liiga Smilshkalne",
    "position": 25,
    "printed_is_unique": false,
    "quantity": 3
  },
  {
    "card_id": "temujin_contract",
    "card_set_id": "blood_money",
    "flavor": "\"The best part is, it's legal!\" -Khan",
    "id": "11026",
    "illustrator": "Timur Shevtsov",
    "position": 26,
    "printed_is_unique": true,
    "quantity": 3
  },
  {
    "card_id": "khan_savvy_skiptracer",
    "card_set_id": "blood_money",
    "id": "11027",
    "illustrator": "Matt Zeilinger",
    "position": 27,
    "printed_is_unique": false,
    "quantity": 3
  },
  {
    "card_id": "data_breach",
    "card_set_id": "blood_money",
    "flavor": "Once a security flaw is identified, there's only a limited window to exploit it before it's patched. Runners call this period \"open season.\"",
    "id": "11028",
    "illustrator": "Juan Novelletto",
    "position": 28,
    "printed_is_unique": false,
    "quantity": 3
  },
  {
    "card_id": "algo_trading",
    "card_set_id": "blood_money",
    "id": "11029",
    "illustrator": "Caroline Elizabeth Huss",
    "position": 29,
    "printed_is_unique": false,
    "quantity": 3
  },
  {
    "card_id": "beth_kilrain_chang",
    "card_set_id": "blood_money",
    "flavor": "\"Coming to you live from the front lines, for now, unless they kill me...\"",
    "id": "11030",
    "illustrator": "Aurore Folny",
    "position": 30,
    "printed_is_unique": true,
    "quantity": 3
  },
  {
    "card_id": "fairchild_2_0",
    "card_set_id": "blood_money",
    "flavor": "To threaten my treasures is to incur my wrath.",
    "id": "11031",
    "illustrator": "Liiga Smilshkalne",
    "position": 31,
    "printed_is_unique": false,
    "quantity": 3
  },
  {
    "card_id": "aiki",
    "card_set_id": "blood_money",
    "flavor": "First, blend with the attacker. Then, control the attack.",
    "id": "11032",
    "illustrator": "BalanceSheet",
    "position": 32,
    "printed_is_unique": false,
    "quantity": 3
  },
  {
    "card_id": "enforcing_loyalty",
    "card_set_id": "blood_money",
    "flavor": "\"Eiko here. It's done.\"",
    "id": "11033",
    "illustrator": "Adam Schumpert",
    "position": 33,
    "printed_is_unique": false,
    "quantity": 3
  },
  {
    "card_id": "hatchet_job",
    "card_set_id": "blood_money",
    "flavor": "\"SELL!! Buy platinum, but GET OUT OF THE TT CREDIT! It is TOXIC!\"",
    "id": "11034",
    "illustrator": "Gary Bedell",
    "position": 34,
    "printed_is_unique": false,
    "quantity": 3
  },
  {
    "card_id": "special_report",
    "card_set_id": "blood_money",
    "flavor": "By the time the report of Emelyov's murder was produced, there had already been a dozen more, hitting all the corps.",
    "id": "11035",
    "illustrator": "Aurore Folny",
    "position": 35,
    "printed_is_unique": false,
    "quantity": 3
  },
  {
    "card_id": "c_i_fund",
    "card_set_id": "blood_money",
    "id": "11036",
    "illustrator": "Samuel Leung",
    "position": 36,
    "printed_is_unique": false,
    "quantity": 3
  },
  {
    "card_id": "liquidation",
    "card_set_id": "blood_money",
    "flavor": "What's a little insurance fraud between friends?",
    "id": "11037",
    "illustrator": "Pavel Kolomeyets",
    "position": 37,
    "printed_is_unique": false,
    "quantity": 3
  },
  {
    "card_id": "weyland_consortium_builder_of_nations",
    "card_set_id": "blood_money",
    "flavor": "Strength makes leaders.",
    "id": "11038",
    "position": 38,
    "printed_is_unique": false,
    "quantity": 3
  },
  {
    "card_id": "financial_collapse",
    "card_set_id": "blood_money",
    "flavor": "She'd never heard her dads argue like this. Not ever. She'd give anything to make it stop.",
    "id": "11039",
    "illustrator": "Matt Zeilinger",
    "position": 39,
    "printed_is_unique": false,
    "quantity": 3
  },
  {
    "card_id": "prisec",
    "card_set_id": "blood_money",
    "flavor": "\"While the money pooled at the top, the power went with it, until there were two sets of laws: one for them, one for us\" -Omar Keung, the Flashpoint",
    "id": "11040",
    "illustrator": "Maciej Rebisz",
    "position": 40,
    "printed_is_unique": false,
    "quantity": 3
  }
]
