[
  {
    "card_id": "the_foundry_refining_the_process",
    "card_set_id": "the_spaces_between",
    "id": "06021",
    "illustrator": "Emilio Rodriguez",
    "position": 21,
    "printed_is_unique": false,
    "quantity": 3
  },
  {
    "card_id": "enhanced_login_protocol",
    "card_set_id": "the_spaces_between",
    "id": "06022",
    "illustrator": "Lili Ibrahim",
    "position": 22,
    "printed_is_unique": false,
    "quantity": 3
  },
  {
    "card_id": "heinlein_grid",
    "card_set_id": "the_spaces_between",
    "flavor": "\"There are many advantages to having facilities on the moon. Less traffic, for example.\" -Director Hass",
    "id": "06023",
    "illustrator": "Henning Ludvigsen",
    "position": 23,
    "printed_is_unique": false,
    "quantity": 3
  },
  {
    "card_id": "encrypted_portals",
    "card_set_id": "the_spaces_between",
    "flavor": "\"Binary computing is obsolete. I use a base-4 structure for this system; it's modeled on our DNA. Well, my DNA, anyway.\" -Doctor Endo, Jinteki researcher",
    "id": "06024",
    "illustrator": "Adam S. Doyle",
    "position": 24,
    "printed_is_unique": false,
    "quantity": 3
  },
  {
    "card_id": "cerebral_static",
    "card_set_id": "the_spaces_between",
    "flavor": "Her eyes were the color of a vidscreen, tuned to a dead channel.",
    "id": "06025",
    "illustrator": "Lili Ibrahim",
    "position": 25,
    "printed_is_unique": false,
    "quantity": 3
  },
  {
    "card_id": "targeted_marketing",
    "card_set_id": "the_spaces_between",
    "id": "06026",
    "illustrator": "Gong Studios",
    "position": 26,
    "printed_is_unique": false,
    "quantity": 3
  },
  {
    "card_id": "information_overload",
    "card_set_id": "the_spaces_between",
    "flavor": "Throw enough data at a runner and it ceases to have any meaning at all.",
    "id": "06027",
    "illustrator": "Ed Mattinian",
    "position": 27,
    "printed_is_unique": false,
    "quantity": 3
  },
  {
    "card_id": "paywall_implementation",
    "card_set_id": "the_spaces_between",
    "id": "06028",
    "illustrator": "Gong Studios",
    "position": 28,
    "printed_is_unique": false,
    "quantity": 3
  },
  {
    "card_id": "sealed_vault",
    "card_set_id": "the_spaces_between",
    "flavor": "Nothing is impenetrable. The key is to make breaking into it more costly than what it's worth.",
    "id": "06029",
    "illustrator": "Bruno Balixa",
    "position": 29,
    "printed_is_unique": false,
    "quantity": 3
  },
  {
    "card_id": "eden_fragment",
    "card_set_id": "the_spaces_between",
    "id": "06030",
    "illustrator": "Seage",
    "position": 30,
    "printed_is_unique": true,
    "quantity": 3
  },
  {
    "card_id": "lag_time",
    "card_set_id": "the_spaces_between",
    "flavor": "\"I don't care how good your console is, or how tricked out your rig is. The lag time on a run on the moon from earthside can be a killer.\" -Leela Patel",
    "id": "06031",
    "illustrator": "Ed Mattinian",
    "position": 31,
    "printed_is_unique": false,
    "quantity": 3
  },
  {
    "card_id": "will_o_the_wisp",
    "card_set_id": "the_spaces_between",
    "id": "06032",
    "illustrator": "Adam S. Doyle",
    "position": 32,
    "printed_is_unique": false,
    "quantity": 3
  },
  {
    "card_id": "d4v1d",
    "card_set_id": "the_spaces_between",
    "flavor": "Sometimes a single stone is enough.",
    "id": "06033",
    "illustrator": "Andreas Zafiratos",
    "position": 33,
    "printed_is_unique": false,
    "quantity": 3
  },
  {
    "card_id": "scrubbed",
    "card_set_id": "the_spaces_between",
    "id": "06034",
    "illustrator": "Chris Newman",
    "position": 34,
    "printed_is_unique": false,
    "quantity": 3
  },
  {
    "card_id": "three_steps_ahead",
    "card_set_id": "the_spaces_between",
    "flavor": "In this business, you had to anticipate. If you weren't three steps ahead, you were three steps behind.",
    "id": "06035",
    "illustrator": "Beny Maulana",
    "position": 35,
    "printed_is_unique": false,
    "quantity": 3
  },
  {
    "card_id": "unscheduled_maintenance",
    "card_set_id": "the_spaces_between",
    "flavor": "What goes up must always go down.",
    "id": "06036",
    "illustrator": "Aaron Agregado",
    "position": 36,
    "printed_is_unique": false,
    "quantity": 3
  },
  {
    "card_id": "cache",
    "card_set_id": "the_spaces_between",
    "flavor": "\"People keep saying that 'Cash is king' in the business, like it's untraceable in the days of DNA sniffers and microtracers. Digital credits can be just as anonymous, and they're just as easy to counterfeit.\" -Silhouette",
    "id": "06037",
    "illustrator": "Ed Mattinian",
    "position": 37,
    "printed_is_unique": false,
    "quantity": 3
  },
  {
    "card_id": "net_celebrity",
    "card_set_id": "the_spaces_between",
    "flavor": "Fifteen seconds of fame.",
    "id": "06038",
    "illustrator": "Isuardi Therianto",
    "position": 38,
    "printed_is_unique": false,
    "quantity": 3
  },
  {
    "card_id": "llds_energy_regulator",
    "card_set_id": "the_spaces_between",
    "flavor": "Originally not very popular, the regulator was overlooked by those who used energy sinks to protect their rig. But it quickly found an audience once Smoke casted a run on a Blue Sun server, using it to keep her rig online while repeatedly diverting energy spikes in excess of 50,000 volts.",
    "id": "06039",
    "illustrator": "Ed Mattinian",
    "position": 39,
    "printed_is_unique": false,
    "quantity": 3
  },
  {
    "card_id": "ghost_runner",
    "card_set_id": "the_spaces_between",
    "flavor": "In the spaces between the data, do trapped souls from the past persist?",
    "id": "06040",
    "illustrator": "Madeline Boni",
    "position": 40,
    "printed_is_unique": false,
    "quantity": 3
  }
]
