[
  {
    "card_id": "vamp",
    "card_set_id": "trace_amount",
    "flavor": "There was a certain schadenfreude about throwing away your credits.",
    "id": "02021",
    "illustrator": "Ed Mattinian",
    "position": 21,
    "printed_is_unique": false,
    "quantity": 3
  },
  {
    "card_id": "liberated_account",
    "card_set_id": "trace_amount",
    "flavor": "It's easier to spend when it's not your money.",
    "id": "02022",
    "illustrator": "Matt Zeilinger",
    "position": 22,
    "printed_is_unique": false,
    "quantity": 3
  },
  {
    "card_id": "satellite_uplink",
    "card_set_id": "trace_amount",
    "flavor": "T-minus 13 seconds. Leela had to work fast. She jacked in the mesa wire and activated the screen. 7 seconds. The internal SLD was still booting. 4 seconds. The interface flickered to life with an orange glow. 2 seconds. With a tap of a finger she was in.",
    "id": "02023",
    "illustrator": "Matt Zeilinger",
    "position": 23,
    "printed_is_unique": false,
    "quantity": 3
  },
  {
    "card_id": "e3_feedback_implants",
    "card_set_id": "trace_amount",
    "flavor": "CyberSolutions' e3 line of implants trade strictly in muscle memory and autonomic responses, freeing the brain to focus entirely on cerebral tasks.",
    "id": "02024",
    "illustrator": "Mauricio Herrera",
    "position": 24,
    "printed_is_unique": false,
    "quantity": 3
  },
  {
    "card_id": "compromised_employee",
    "card_set_id": "trace_amount",
    "id": "02025",
    "illustrator": "Mitchell Malloy",
    "position": 25,
    "printed_is_unique": false,
    "quantity": 3
  },
  {
    "card_id": "notoriety",
    "card_set_id": "trace_amount",
    "flavor": "When you're this good, it's hard not to grow a fan base.",
    "id": "02026",
    "illustrator": "Matt Zeilinger",
    "position": 26,
    "printed_is_unique": false,
    "quantity": 3
  },
  {
    "card_id": "snowball",
    "card_set_id": "trace_amount",
    "flavor": "\"If your snowball gets big enough, you can make it into a snowman!\" -Chaos Theory",
    "id": "02027",
    "illustrator": "Adam S. Doyle",
    "position": 27,
    "printed_is_unique": false,
    "quantity": 3
  },
  {
    "card_id": "dyson_mem_chip",
    "card_set_id": "trace_amount",
    "flavor": "Archaic but reliable.",
    "id": "02028",
    "illustrator": "JB Casacop",
    "position": 28,
    "printed_is_unique": false,
    "quantity": 3
  },
  {
    "card_id": "encryption_protocol",
    "card_set_id": "trace_amount",
    "flavor": "The key to the future lies in the past.",
    "id": "02029",
    "illustrator": "Adam S. Doyle",
    "position": 29,
    "printed_is_unique": false,
    "quantity": 3
  },
  {
    "card_id": "sherlock_1_0",
    "card_set_id": "trace_amount",
    "id": "02030",
    "illustrator": "Matt Zeilinger",
    "position": 30,
    "printed_is_unique": false,
    "quantity": 3
  },
  {
    "card_id": "jinteki_replicating_perfection",
    "card_set_id": "trace_amount",
    "id": "02031",
    "position": 31,
    "printed_is_unique": false,
    "quantity": 3
  },
  {
    "card_id": "fetal_ai",
    "card_set_id": "trace_amount",
    "id": "02032",
    "illustrator": "Eko Puteh",
    "position": 32,
    "printed_is_unique": false,
    "quantity": 3
  },
  {
    "card_id": "trick_of_light",
    "card_set_id": "trace_amount",
    "flavor": "Smoke and mirrors optional.",
    "id": "02033",
    "illustrator": "Anna Ignatieva",
    "position": 33,
    "printed_is_unique": false,
    "quantity": 3
  },
  {
    "card_id": "sensei",
    "card_set_id": "trace_amount",
    "flavor": "Peace and violence. Both must lead to the same place.",
    "id": "02034",
    "illustrator": "Sandara Tang",
    "position": 34,
    "printed_is_unique": false,
    "quantity": 3
  },
  {
    "card_id": "big_brother",
    "card_set_id": "trace_amount",
    "flavor": "Looking out for your interests since 1984.",
    "id": "02035",
    "illustrator": "Matt Zeilinger",
    "position": 35,
    "printed_is_unique": false,
    "quantity": 3
  },
  {
    "card_id": "chilo_city_grid",
    "card_set_id": "trace_amount",
    "flavor": "Clones whisper of ChiLo as a promised land of freedom.",
    "id": "02036",
    "illustrator": "Jonathan Lee",
    "position": 36,
    "printed_is_unique": false,
    "quantity": 3
  },
  {
    "card_id": "power_grid_overload",
    "card_set_id": "trace_amount",
    "id": "02037",
    "illustrator": "Howard Schechlman",
    "position": 37,
    "printed_is_unique": false,
    "quantity": 3
  },
  {
    "card_id": "amazon_industrial_zone",
    "card_set_id": "trace_amount",
    "id": "02038",
    "illustrator": "Jon Hrubesch",
    "position": 38,
    "printed_is_unique": false,
    "quantity": 3
  },
  {
    "card_id": "executive_retreat",
    "card_set_id": "trace_amount",
    "id": "02039",
    "illustrator": "JB Casacop",
    "position": 39,
    "printed_is_unique": false,
    "quantity": 3
  },
  {
    "card_id": "freelancer",
    "card_set_id": "trace_amount",
    "flavor": "No contract. Just a handshake and a fistful of C-6 high explosives.",
    "id": "02040",
    "illustrator": "RJ Palmer",
    "position": 40,
    "printed_is_unique": false,
    "quantity": 3
  }
]
