[
  {
    "card_id": "pinhole_threading",
    "card_set_id": "ms",
    "flavor": "NeneciÄŸim would be proud.",
    "id": "33013",
    "illustrator": "Bruno Balixa",
    "position": 13,
    "printed_is_unique": false,
    "printed_text": "Run any server. If successful, instead of breaching the attacked server, access 1 card in the root of another server. If that card is an agenda, you cannot steal or trash it during this access.",
    "quantity": 3,
    "stripped_printed_text": "Run any server. If successful, instead of breaching the attacked server, access 1 card in the root of another server. If that card is an agenda, you cannot steal or trash it during this access."
  }
]
